{
  "recordKind": "hacp.v0_3_candidate.review_finding",
  "schemaVersion": "hacp-0.3-candidate",
  "findingId": "finding_example_stop_authority_basis_001",
  "packetId": "taskpkt_example_pre_start_stop_001",
  "packetDigest": {
    "algorithm": "sha256",
    "canonicalization": "json-rfc8785-jcs",
    "digestDomain": "io.hacp.task-packet.v0.3-candidate",
    "value": "399ad944ac1ead3047090a783422d3ff2628e3d5f02d77576951137d35ee2664"
  },
  "severity": "medium",
  "summary": "Returned evidence is actionable, but continuation would consume a human decision and start a successor invocation.",
  "affectedSurfaces": [
    "repo://example/hacp/docs/source-packets/"
  ],
  "evidenceRefs": [
    "evidence://example/review-output-001"
  ],
  "recommendedDisposition": "request_human_decision",
  "residualRisk": "The successor invocation must be bounded to docs-only work and must not infer merge authority.",
  "humanDecisionRequired": true,
  "digest": {
    "algorithm": "sha256",
    "canonicalization": "json-rfc8785-jcs",
    "digestDomain": "io.hacp.review-finding.v0.3-candidate",
    "value": "d7a89ae1767442b8e6c7276a3924df3defdab507fa4cd928fc9840acdc7aa5b9"
  }
}
